{
  "$schema": "contracts/device-conformance-plan.schema.json",
  "schemaVersion": 1,
  "kitVersion": "1.0.0",
  "generatedBy": "tools/device-conformance/generate-device-conformance-kit.mjs",
  "contracts": {
    "hostRequest": "1.2.0",
    "hostResult": "1.0.0",
    "typeCount": 58,
    "fixtureHashEncoding": "sorted-key-json-utf8"
  },
  "releaseIdentityAuthority": {
    "manifestPath": "UI_RELEASE_MANIFEST.json",
    "sourceShaAuthority": "R13 staged release metadata or verified host consumer lock",
    "manifestShaAuthority": "sha256 of the exact raw UI_RELEASE_MANIFEST.json bytes used by the run",
    "releaseIdRule": "sourceSha:manifestSha",
    "embeddedReleaseIdentity": false
  },
  "verificationPolicy": {
    "deviceVerifiedDefault": false,
    "exactRecordCount": 174,
    "requiredPerRecordIdentity": [
      "host",
      "sourceSha",
      "manifestSha",
      "deviceId",
      "type"
    ],
    "fixtureValidationIsExecutionEvidence": false,
    "trustedContextRequired": true,
    "proofArtifactDigestRequired": true,
    "syntheticSummaryAccepted": false
  },
  "sources": [
    {
      "path": "contracts/host-request.schema.json",
      "byteLength": 31494,
      "sha256": "39fa3556a6f2dd9ec814b5db75462eeb9e0d5ab920351986f6600fc063cfd89d"
    },
    {
      "path": "contracts/host-result.schema.json",
      "byteLength": 30846,
      "sha256": "019d97f7b72d7d13e2a3f7b53184f1629e98ab7927444a699f9190a4f6ea2d4d"
    },
    {
      "path": "contracts/fixtures/host-request.fixtures.json",
      "byteLength": 8855,
      "sha256": "27200293dd75a1feb39a32d6658c06a1762e23f5b694e51d1c6e67fdcdea85ca"
    },
    {
      "path": "contracts/fixtures/host-result.fixtures.json",
      "byteLength": 7939,
      "sha256": "547bd36f2bd6ee26600cccab6507e2a536fd2a02fa5a2af871cb5eeefab081b1"
    },
    {
      "path": "contracts/VERSION.json",
      "byteLength": 36708,
      "sha256": "3e6fd31a8130982a258749a1237f25b5b970e8104340d46132f212fdc0a57639"
    },
    {
      "path": "tools/device-conformance/device-conformance-policy.mjs",
      "byteLength": 4344,
      "sha256": "8681ced6fa1ba08dd0f0d18cce738936781315e8e2fecdb743d3f1dcc83c169e"
    }
  ],
  "hosts": [
    {
      "host": "ios",
      "cases": [
        {
          "sequence": 1,
          "type": "http.execute",
          "capability": "http",
          "minimumProofTier": "simulator",
          "destructive": false,
          "externalSideEffect": true,
          "requestFixture": {
            "path": "contracts/fixtures/host-request.fixtures.json",
            "index": 0,
            "fixtureSha256": "0abd3ce23c81b11d30a3299cb66753c84fc2356bf58a927ae58b7164c6ef45c1",
            "requestId": "hr-001",
            "correlationId": "h-001"
          },
          "expectedResultFixture": {
            "path": "contracts/fixtures/host-result.fixtures.json",
            "index": 0,
            "fixtureSha256": "c28d5466a8c3e4fab0ea888743624bf2de6503c54baa99c121d2c57454afefb2",
            "requestId": "hr-001",
            "correlationId": "h-001"
          },
          "deviceVerified": false
        },
        {
          "sequence": 2,
          "type": "http.cancel",
          "capability": "http",
          "minimumProofTier": "simulator",
          "destructive": false,
          "externalSideEffect": true,
          "requestFixture": {
            "path": "contracts/fixtures/host-request.fixtures.json",
            "index": 1,
            "fixtureSha256": "277017d627c8d29876ece4ef48fce690672f09685b5ccc2780eb5562a7d9a11a",
            "requestId": "hr-002",
            "correlationId": "h-002"
          },
          "expectedResultFixture": {
            "path": "contracts/fixtures/host-result.fixtures.json",
            "index": 1,
            "fixtureSha256": "26e9b3a6d4cecf9cc88f21ec6b842f85f0a3bd35db70b85d63469def34451d5a",
            "requestId": "hr-002",
            "correlationId": "h-002"
          },
          "deviceVerified": false
        },
        {
          "sequence": 3,
          "type": "webview.open",
          "capability": "webview",
          "minimumProofTier": "simulator",
          "destructive": false,
          "externalSideEffect": true,
          "requestFixture": {
            "path": "contracts/fixtures/host-request.fixtures.json",
            "index": 2,
            "fixtureSha256": "9c57a1ad0d627ed3a30fd123fdf6312180ef2a867c5958196483c99c3211271a",
            "requestId": "hr-003",
            "correlationId": "h-003"
          },
          "expectedResultFixture": {
            "path": "contracts/fixtures/host-result.fixtures.json",
            "index": 2,
            "fixtureSha256": "5be25373c9120343e53648b122781ba1bc3c733a439f356746d216ea035a8ffc",
            "requestId": "hr-003",
            "correlationId": "h-003"
          },
          "deviceVerified": false
        },
        {
          "sequence": 4,
          "type": "webview.close",
          "capability": "webview",
          "minimumProofTier": "simulator",
          "destructive": false,
          "externalSideEffect": true,
          "requestFixture": {
            "path": "contracts/fixtures/host-request.fixtures.json",
            "index": 3,
            "fixtureSha256": "3cf2b5581cdd44faac8eb67d5bd857207d9bae778058941049324331e5062f20",
            "requestId": "hr-004",
            "correlationId": "h-004"
          },
          "expectedResultFixture": {
            "path": "contracts/fixtures/host-result.fixtures.json",
            "index": 3,
            "fixtureSha256": "6732f9ef101bd9070177c9eaaf9ebdc500a69ced681ae67e534a3f2216877342",
            "requestId": "hr-004",
            "correlationId": "h-004"
          },
          "deviceVerified": false
        },
        {
          "sequence": 5,
          "type": "webview.evaluate",
          "capability": "webview",
          "minimumProofTier": "simulator",
          "destructive": false,
          "externalSideEffect": true,
          "requestFixture": {
            "path": "contracts/fixtures/host-request.fixtures.json",
            "index": 4,
            "fixtureSha256": "c0cd85928d3a2607f21a037635f5bfea086a10b940f6b069283a035ae3653a8c",
            "requestId": "hr-005",
            "correlationId": "h-005"
          },
          "expectedResultFixture": {
            "path": "contracts/fixtures/host-result.fixtures.json",
            "index": 4,
            "fixtureSha256": "58ba469744e3895c20ca6eca3a688becdee83a010d9b675b2233bf66c938cdb1",
            "requestId": "hr-005",
            "correlationId": "h-005"
          },
          "deviceVerified": false
        },
        {
          "sequence": 6,
          "type": "cookie.get",
          "capability": "cookie",
          "minimumProofTier": "simulator",
          "destructive": false,
          "externalSideEffect": false,
          "requestFixture": {
            "path": "contracts/fixtures/host-request.fixtures.json",
            "index": 5,
            "fixtureSha256": "f0fdbd4539181dc7229aa37cad56425dc8d786166d6ed30f6186dbed6206f331",
            "requestId": "hr-006",
            "correlationId": "h-006"
          },
          "expectedResultFixture": {
            "path": "contracts/fixtures/host-result.fixtures.json",
            "index": 5,
            "fixtureSha256": "ae533540291b88dfecc531ea8c024f584246d8e1502b4b8da81832c3e874d759",
            "requestId": "hr-006",
            "correlationId": "h-006"
          },
          "deviceVerified": false
        },
        {
          "sequence": 7,
          "type": "cookie.set",
          "capability": "cookie",
          "minimumProofTier": "simulator",
          "destructive": false,
          "externalSideEffect": true,
          "requestFixture": {
            "path": "contracts/fixtures/host-request.fixtures.json",
            "index": 6,
            "fixtureSha256": "8342134f79fb367d7e4dcda805aeacc39e8157edf7eb0396767f67f511e4468e",
            "requestId": "hr-007",
            "correlationId": "h-007"
          },
          "expectedResultFixture": {
            "path": "contracts/fixtures/host-result.fixtures.json",
            "index": 6,
            "fixtureSha256": "4acf09544bfd9b6b07a2c75d5da379b148995bdf4db963457988ac1102c0e93b",
            "requestId": "hr-007",
            "correlationId": "h-007"
          },
          "deviceVerified": false
        },
        {
          "sequence": 8,
          "type": "cookie.clear",
          "capability": "cookie",
          "minimumProofTier": "simulator",
          "destructive": true,
          "externalSideEffect": true,
          "requestFixture": {
            "path": "contracts/fixtures/host-request.fixtures.json",
            "index": 7,
            "fixtureSha256": "600a8a34eb69a81014357850d60bfe3c583ca2084d8bc5b499f98474a0e12805",
            "requestId": "hr-008",
            "correlationId": "h-008"
          },
          "expectedResultFixture": {
            "path": "contracts/fixtures/host-result.fixtures.json",
            "index": 7,
            "fixtureSha256": "c3327846f041e9dff3f91035cf6a1212f95bb2b83b61ce30b703247a0e213a11",
            "requestId": "hr-008",
            "correlationId": "h-008"
          },
          "deviceVerified": false
        },
        {
          "sequence": 9,
          "type": "file.read",
          "capability": "file",
          "minimumProofTier": "simulator",
          "destructive": false,
          "externalSideEffect": false,
          "requestFixture": {
            "path": "contracts/fixtures/host-request.fixtures.json",
            "index": 8,
            "fixtureSha256": "5126bcf77ffc6cc67f848a33e54132513bedb48172b2596eee4c621b2e686335",
            "requestId": "hr-009",
            "correlationId": "h-009"
          },
          "expectedResultFixture": {
            "path": "contracts/fixtures/host-result.fixtures.json",
            "index": 8,
            "fixtureSha256": "eb1f4f09132b2ceaa6f5c41986d9650266b7871db6f2b400d55c85f260b3a637",